{
  "published_scope": "example string",
  "options": [
    {
      "values": [
        "example string",
        "example string",
        "example string"
      ],
      "id": 123,
      "name": "example string",
      "position": 123,
      "product_id": 123
    },
    {
      "position": 123,
      "product_id": 123,
      "values": [
        "example string"
      ],
      "id": 123,
      "name": "example string"
    }
  ],
  "vendor": "example string",
  "published_at": "2019-01-01 00:00:00.000Z",
  "body_html": "example string",
  "id": 123,
  "image": {
    "height": 123,
    "position": 123,
    "updated_at": "2019-01-01 00:00:00.000Z",
    "variant_ids": [
      123,
      123,
      123
    ],
    "admin_graphql_api_id": "https://www.example.com/",
    "created_at": "2019-01-01 00:00:00.000Z",
    "product_id": 123,
    "alt": null,
    "src": "https://www.example.com/",
    "width": 123,
    "id": 123
  },
  "template_suffix": null,
  "admin_graphql_api_id": "https://www.example.com/",
  "variants": [
    {
      "barcode": null,
      "option1": "example string",
      "product_id": 123,
      "sku": "example string",
      "weight_unit": "example string",
      "option3": null,
      "old_inventory_quantity": 123,
      "option2": "example string",
      "inventory_policy": "example string",
      "grams": 123,
      "inventory_item_id": 123,
      "position": 123,
      "weight": 123.456,
      "id": 123,
      "title": "example string",
      "image_id": 123,
      "inventory_quantity": 123,
      "updated_at": "2019-01-01 00:00:00.000Z",
      "admin_graphql_api_id": "https://www.example.com/",
      "compare_at_price": null,
      "taxable": true,
      "price": "example string",
      "created_at": "2019-01-01 00:00:00.000Z",
      "requires_shipping": true,
      "inventory_management": "example string",
      "fulfillment_service": "example string"
    },
    {
      "inventory_management": "example string",
      "position": 123,
      "option1": "example string",
      "image_id": 123,
      "inventory_quantity": 123,
      "old_inventory_quantity": 123,
      "fulfillment_service": "example string",
      "barcode": null,
      "compare_at_price": null,
      "created_at": "2019-01-01 00:00:00.000Z",
      "grams": 123,
      "weight_unit": "example string",
      "sku": "example string",
      "weight": 123.456,
      "option2": "example string",
      "product_id": 123,
      "inventory_policy": "example string",
      "taxable": true,
      "requires_shipping": true,
      "updated_at": "2019-01-01 00:00:00.000Z",
      "inventory_item_id": 123,
      "admin_graphql_api_id": "https://www.example.com/",
      "id": 123,
      "option3": null,
      "price": "example string",
      "title": "example string"
    },
    {
      "created_at": "2019-01-01 00:00:00.000Z",
      "barcode": null,
      "updated_at": "2019-01-01 00:00:00.000Z",
      "inventory_management": "example string",
      "option1": "example string",
      "sku": "example string",
      "option2": "example string",
      "price": "example string",
      "grams": 123,
      "inventory_policy": "example string",
      "admin_graphql_api_id": "https://www.example.com/",
      "weight": 123.456,
      "position": 123,
      "id": 123,
      "fulfillment_service": "example string",
      "taxable": true,
      "old_inventory_quantity": 123,
      "title": "example string",
      "product_id": 123,
      "requires_shipping": true,
      "weight_unit": "example string",
      "inventory_quantity": 123,
      "option3": null,
      "image_id": 123,
      "compare_at_price": null,
      "inventory_item_id": 123
    }
  ],
  "updated_at": "2019-01-01 00:00:00.000Z",
  "images": [
    {
      "height": 123,
      "id": 123,
      "src": "https://www.example.com/",
      "updated_at": "2019-01-01 00:00:00.000Z",
      "variant_ids": [
        123,
        123,
        123
      ],
      "admin_graphql_api_id": "https://www.example.com/",
      "alt": null,
      "created_at": "2019-01-01 00:00:00.000Z",
      "product_id": 123,
      "position": 123,
      "width": 123
    },
    {
      "width": 123,
      "height": 123,
      "id": 123,
      "position": 123,
      "src": "https://www.example.com/",
      "variant_ids": [],
      "alt": null,
      "created_at": "2019-01-01 00:00:00.000Z",
      "admin_graphql_api_id": "https://www.example.com/",
      "updated_at": "2019-01-01 00:00:00.000Z",
      "product_id": 123
    },
    {
      "updated_at": "2019-01-01 00:00:00.000Z",
      "variant_ids": [],
      "height": 123,
      "id": 123,
      "src": "https://www.example.com/",
      "admin_graphql_api_id": "https://www.example.com/",
      "created_at": "2019-01-01 00:00:00.000Z",
      "position": 123,
      "product_id": 123,
      "alt": null,
      "width": 123
    },
    {
      "created_at": "2019-01-01 00:00:00.000Z",
      "id": 123,
      "product_id": 123,
      "updated_at": "2019-01-01 00:00:00.000Z",
      "width": 123,
      "admin_graphql_api_id": "https://www.example.com/",
      "alt": null,
      "src": "https://www.example.com/",
      "height": 123,
      "position": 123,
      "variant_ids": []
    },
    {
      "src": "https://www.example.com/",
      "variant_ids": [],
      "width": 123,
      "admin_graphql_api_id": "https://www.example.com/",
      "updated_at": "2019-01-01 00:00:00.000Z",
      "id": 123,
      "created_at": "2019-01-01 00:00:00.000Z",
      "alt": null,
      "position": 123,
      "height": 123,
      "product_id": 123
    }
  ],
  "tags": "example string",
  "status": "example string",
  "product_type": "example string",
  "title": "example string",
  "handle": "example string",
  "variant_ids": [
    {
      "id": 123
    },
    {
      "id": 123
    },
    {
      "id": 123
    }
  ],
  "created_at": "2019-01-01 00:00:00.000Z"
}
